{
  "record_id": "OBJ-0001",
  "version": "0.1",
  "title": "Blue Ceramic Bird",
  "record_type": "Object",
  "status": "Human Review",
  "identity": {
    "description": "A small glazed ceramic bird with a deep blue body and a white-speckled breast.",
    "aliases": [
      "Grandmother's blue bird"
    ],
    "category": "Decorative object",
    "maker_or_creator": null,
    "materials": [
      "Glazed ceramic"
    ],
    "distinguishing_features": "A small chip beneath the left wing is visible only when the object is turned over."
  },
  "meaning": {
    "why_kept": "The fictional Marlow family keeps the bird because it is associated with Elena Marlow's grandmother and has appeared in family homes for decades.",
    "family_significance": "It is treated as a symbol of continuity between generations, although the details of its original acquisition remain incomplete.",
    "associated_people": [
      "Elena Marlow",
      "Ruth Marlow"
    ],
    "associated_events": [
      "Elena's first apartment"
    ],
    "intended_future": "Remain in the family and eventually pass to a younger relative."
  },
  "provenance": {
    "acquisition_method": "Reported family gift",
    "source_or_giver": "Reportedly Ruth Marlow",
    "acquired_date": null,
    "acquired_place": null,
    "certainty": "Medium",
    "summary": "Family members report that Ruth Marlow gave the bird to Elena. The exact year is unknown. A dated photograph confirms that Elena possessed it by 1991."
  },
  "location_and_state": {
    "current_area": "Hallway",
    "exact_location": "Top shelf of the fictional Marlow family display cabinet",
    "lifecycle_state": "Displayed",
    "condition": "Good, with one small chip beneath the left wing",
    "nested_in_or_displayed_with": [
      "Framed family photograph",
      "Small brass key"
    ]
  },
  "claims": [
    {
      "claim_id": "CLM-001",
      "statement": "The blue ceramic bird was displayed in Elena Marlow's first apartment by 1991.",
      "claim_type": "Provenance",
      "epistemic_state": "Known",
      "confidence": 0.95,
      "evidence_ids": [
        "EVID-001"
      ],
      "notes": "Supported by a dated photograph."
    },
    {
      "claim_id": "CLM-002",
      "statement": "Ruth Marlow gave the bird to Elena Marlow.",
      "claim_type": "Provenance",
      "epistemic_state": "Reported",
      "confidence": 0.65,
      "evidence_ids": [
        "EVID-002"
      ],
      "notes": "Attributed family account; no receipt or contemporaneous note has been found."
    },
    {
      "claim_id": "CLM-003",
      "statement": "The exact acquisition year is unknown.",
      "claim_type": "Provenance",
      "epistemic_state": "Unknown",
      "confidence": 1.0,
      "evidence_ids": [],
      "notes": "The record intentionally preserves this gap."
    }
  ],
  "evidence": [
    {
      "evidence_id": "EVID-001",
      "evidence_type": "Photo",
      "source_name": "Fictional apartment photograph dated June 1991",
      "captured_date": "1991-06-15",
      "contributor": "Elena Marlow",
      "excerpt_or_observation": "The blue ceramic bird is visible on a shelf behind Elena.",
      "sha256": null,
      "reliability": "Primary",
      "privacy_class": "Public Demo"
    },
    {
      "evidence_id": "EVID-002",
      "evidence_type": "Interview",
      "source_name": "Fictional family interview with Elena Marlow",
      "captured_date": "2026-07-12",
      "contributor": "Elena Marlow",
      "excerpt_or_observation": "Elena recalls that her grandmother gave her the bird but does not remember the year.",
      "sha256": null,
      "reliability": "Reported",
      "privacy_class": "Public Demo"
    }
  ],
  "relationships": [
    {
      "relationship_id": "REL-001",
      "relation_type": "GIVEN_BY",
      "target": "Ruth Marlow",
      "evidence_ids": [
        "EVID-002"
      ],
      "notes": "Reported relationship, not independently verified."
    },
    {
      "relationship_id": "REL-002",
      "relation_type": "DISPLAYED_IN",
      "target": "Fictional Marlow hallway display cabinet",
      "evidence_ids": [],
      "notes": "Current demonstration location."
    }
  ],
  "events": [
    {
      "event_id": "EVT-001",
      "date_or_range": "By June 1991",
      "event_type": "Displayed",
      "description": "The bird was photographed in Elena Marlow's first apartment.",
      "before_state": null,
      "after_state": "Displayed in Elena's apartment",
      "evidence_ids": [
        "EVID-001"
      ],
      "certainty": "High"
    }
  ],
  "questions_and_answers": [
    {
      "qa_id": "QA-001",
      "question": "Why does the family keep the blue ceramic bird?",
      "answer": "The family keeps it because it is associated with Elena's grandmother and has remained part of the family's homes for decades.",
      "answer_mode": "Qualified",
      "evidence_ids": [
        "EVID-001",
        "EVID-002"
      ],
      "claim_ids": [
        "CLM-001",
        "CLM-002"
      ],
      "privacy_class": "Public Demo",
      "status": "Approved"
    },
    {
      "qa_id": "QA-002",
      "question": "When did the family acquire it?",
      "answer": "The exact acquisition year is unknown. A photograph confirms that Elena had it by June 1991.",
      "answer_mode": "Unknown",
      "evidence_ids": [
        "EVID-001"
      ],
      "claim_ids": [
        "CLM-001",
        "CLM-003"
      ],
      "privacy_class": "Public Demo",
      "status": "Approved"
    }
  ],
  "privacy": {
    "privacy_class": "Public Demo",
    "human_approval_required": true,
    "child_sensitive": false,
    "medical_related": false,
    "financial_related": false,
    "living_person_sensitive": false,
    "redacted_topics": []
  },
  "approval": {
    "state": "Pending",
    "approved_by": null,
    "decision_id": null,
    "approval_date": null,
    "conditions": "Synthetic demonstration record only."
  }
}
